{
  "schemaVersion": 1,
  "caseId": "G6-A3-hand-left",
  "fixture": {
    "path": "audit-r1/fixtures/g6_unison_two_staves.musicxml",
    "sha256": "9fae445ebcbd727f4c0b13e0ec4b86715073a9f13f5e955e165ea0f8cd546bf0"
  },
  "configSha256": "7bef4f8fcbdecef70d974b47b7d59159fedf0b51ab78a66d1a89ce3b36b6191c",
  "sides": {
    "expected": {
      "kind": "expected",
      "source": "audit-r1/fixtures/parity-cases/expected/G6-A3-hand-left.json"
    },
    "candidate": {
      "kind": "ts-legacy-reference",
      "gitSha": "09e30ab1afd45ff5d258ff98a8fb4f402d7bf724",
      "plannerVersion": "parity-harness-1",
      "engineVersion": "1.0.0"
    }
  },
  "rustSide": "not-implemented / not-run",
  "l1": {
    "status": "pass",
    "fingerprint": "plan-v1:sha256:904251663e9535508731bc2598593308b85bf68215488339241905d1dec0515d",
    "fingerprintErrorCode": null,
    "stableAcrossRuns": true,
    "note": "TS-side only: stability of the frozen input under the gated fingerprint. TS↔Rust L1 equality is deferred to R2-3."
  },
  "l2": {
    "status": "pass",
    "occurrenceCount": 1,
    "groupCount": 1,
    "diffCount": 0
  },
  "l3": {
    "status": "pass",
    "atomCount": 1,
    "scoreEventCount": 1,
    "wireCompatibility": "pass",
    "p1_3Invariants": [
      {
        "check": "onset-group set == atom onset set (exact µs)",
        "status": "pass",
        "detail": "groups=[3000000] atoms=[3000000]"
      },
      {
        "check": "atom nominal duration == longest member duration (exact µs)",
        "status": "pass"
      },
      {
        "check": "scoreEvents measure set == atom bar set",
        "status": "pass",
        "detail": "scoreEvents=[1] atoms=[1]"
      },
      {
        "check": "atom ticks are exact integers on the PPQ grid",
        "status": "pass"
      }
    ]
  },
  "summary": {
    "status": "pass",
    "categories": {
      "identity-mapping": 0,
      "serialization-only": 0,
      "time-rounding": 0,
      "semantic-defect": 0,
      "unsupported-behavior": 0,
      "unclassified": 0
    },
    "pass": true
  },
  "diffs": [],
  "meta": {
    "generatedAt": "2026-10-24T16:24:07.066Z",
    "gitSha": "09e30ab1afd45ff5d258ff98a8fb4f402d7bf724",
    "command": "parity-runner --mode=full --reportDir=../audit-r1/reports/r2-2",
    "timeConversionVersion": "time-conversion-v1",
    "fingerprintSchemaVersion": 1,
    "parityGateDoc": "audit-r1/docs/TS_RUST_PARITY_GATE_V1.md @ 838cd9b"
  }
}
