{
  "schemaVersion": 1,
  "caseId": "G3-range-m2",
  "fixture": {
    "path": "audit-r1/fixtures/g3_tie_across_bar.musicxml",
    "sha256": "86b9560aac48c47e80934ae5a10763784a40487b663356e85bef16bfabb61c2f"
  },
  "configSha256": "0a4536c661cf536e46862b6f69fdffe59a9a2bcdb453818c7ab8425778ab594b",
  "sides": {
    "expected": {
      "kind": "expected",
      "source": "audit-r1/fixtures/parity-cases/expected/G3-range-m2.json"
    },
    "candidate": {
      "kind": "ts-legacy-reference",
      "gitSha": "a99710a28853e2d0996e3c49bb73a863d9cec44a",
      "plannerVersion": "parity-harness-1",
      "engineVersion": "1.0.0"
    }
  },
  "rustSide": "not-implemented / not-run",
  "l1": {
    "status": "pass",
    "fingerprint": null,
    "fingerprintErrorCode": "PAYLOAD_VALIDATION_FAILED",
    "stableAcrossRuns": true,
    "note": "TS-side only: stability of the frozen input under the gated fingerprint. TS↔Rust L1 equality is deferred to R2-3."
  },
  "l2": {
    "status": "pass",
    "occurrenceCount": 0,
    "groupCount": 0,
    "diffCount": 0
  },
  "l3": {
    "status": "pass",
    "atomCount": 0,
    "scoreEventCount": 0,
    "wireCompatibility": "pass",
    "p1_3Invariants": [
      {
        "check": "onset-group set == atom onset set (exact µs)",
        "status": "pass",
        "detail": "groups=[] atoms=[]"
      },
      {
        "check": "atom nominal duration == longest member duration (exact µs)",
        "status": "pass"
      },
      {
        "check": "scoreEvents measure set == atom bar set",
        "status": "pass",
        "detail": "scoreEvents=[] atoms=[]"
      },
      {
        "check": "atom ticks are exact integers on the PPQ grid",
        "status": "pass"
      }
    ]
  },
  "summary": {
    "status": "pass",
    "categories": {
      "identity-mapping": 0,
      "serialization-only": 0,
      "time-rounding": 0,
      "semantic-defect": 0,
      "unsupported-behavior": 0,
      "unclassified": 0
    },
    "pass": true
  },
  "diffs": [],
  "meta": {
    "generatedAt": "2026-10-24T17:33:18.756Z",
    "gitSha": "a99710a28853e2d0996e3c49bb73a863d9cec44a",
    "command": "parity-runner --mode=full --reportDir=../audit-r1/reports/r2-2",
    "timeConversionVersion": "time-conversion-v1",
    "fingerprintSchemaVersion": 1,
    "parityGateDoc": "audit-r1/docs/TS_RUST_PARITY_GATE_V1.md @ 838cd9b"
  }
}
