{
  "schemaVersion": 1,
  "caseId": "A4-multivoice",
  "fixture": {
    "path": "audit-r1/fixtures/parity-cases/a4_multivoice.musicxml",
    "sha256": "d1e08d9917105bb28deff6fe94e33a5a2c9671fb7ee9f7d3349c67d61c0403b6"
  },
  "configSha256": "5f21421187150e809cd48f2c65324967dc4525edfd2b53c6104726915820dee3",
  "sides": {
    "expected": {
      "kind": "expected",
      "source": "audit-r1/fixtures/parity-cases/expected/A4-multivoice.json"
    },
    "candidate": {
      "kind": "ts-legacy-reference",
      "gitSha": "a99710a28853e2d0996e3c49bb73a863d9cec44a",
      "plannerVersion": "parity-harness-1",
      "engineVersion": "1.0.0"
    }
  },
  "rustSide": "not-implemented / not-run",
  "l1": {
    "status": "pass",
    "fingerprint": "plan-v1:sha256:84ab007a8c2a2a0d1c5b4316a6791036604eed7f4d3b1d776132c197a508f71d",
    "fingerprintErrorCode": null,
    "stableAcrossRuns": true,
    "note": "TS-side only: stability of the frozen input under the gated fingerprint. TS↔Rust L1 equality is deferred to R2-3."
  },
  "l2": {
    "status": "pass",
    "occurrenceCount": 4,
    "groupCount": 2,
    "diffCount": 0
  },
  "l3": {
    "status": "pass",
    "atomCount": 2,
    "scoreEventCount": 4,
    "wireCompatibility": "pass",
    "p1_3Invariants": [
      {
        "check": "onset-group set == atom onset set (exact µs)",
        "status": "pass",
        "detail": "groups=[3000000,4500000] atoms=[3000000,4500000]"
      },
      {
        "check": "atom nominal duration == longest member duration (exact µs)",
        "status": "pass"
      },
      {
        "check": "scoreEvents measure set == atom bar set",
        "status": "pass",
        "detail": "scoreEvents=[1] atoms=[1]"
      },
      {
        "check": "atom ticks are exact integers on the PPQ grid",
        "status": "pass"
      }
    ]
  },
  "summary": {
    "status": "pass",
    "categories": {
      "identity-mapping": 0,
      "serialization-only": 0,
      "time-rounding": 0,
      "semantic-defect": 0,
      "unsupported-behavior": 0,
      "unclassified": 0
    },
    "pass": true
  },
  "diffs": [],
  "meta": {
    "generatedAt": "2026-10-24T17:33:18.765Z",
    "gitSha": "a99710a28853e2d0996e3c49bb73a863d9cec44a",
    "command": "parity-runner --mode=full --reportDir=../audit-r1/reports/r2-2",
    "timeConversionVersion": "time-conversion-v1",
    "fingerprintSchemaVersion": 1,
    "parityGateDoc": "audit-r1/docs/TS_RUST_PARITY_GATE_V1.md @ 838cd9b"
  }
}
